URL (slug),Title,H1,Meta Description,Кластер
uborka-na-ulitse-kosmodamianskaya-naberezhnaya-moskva,Уборка на Космодамианской набережной — цены | K-lining,Уборка на Космодамианской набережной,Клининг на Космодамианской набережной. Честные цены.,улицы
uborka-na-ulitse-zubovskiy-bulvar-moskva,Клининг на Зубовском бульваре — 24/7 | K-lining,Клининг на Зубовском бульваре,Профессиональная уборка на Зубовском бульваре. Выезд сегодня.,улицы
uborka-na-ulitse-pleshchikha-moskva,Уборка на ул. Плющиха — цены | K-lining,Уборка на ул. Плющиха,"Клининг на ул. Плющиха: квартиры/офисы, окна. −10% первым заказам.",улицы
uborka-na-ulitse-spiridonovka-moskva,Клининг на ул. Спиридоновка — 24/7 | K-lining,Клининг на ул. Спиридоновка,"Уборка на ул. Спиридоновка. Прозрачные цены, быстрый выезд.",улицы
uborka-na-ulitse-bolshaya-sadovaya-moskva,Уборка на ул. Большая Садовая — цены | K-lining,Уборка на ул. Большая Садовая,"Профессиональная уборка на Большой Садовой. Окна, квартиры, офисы.",улицы
uborka-na-ulitse-krasnaya-presnya-moskva,Клининг на ул. Красная Пресня — 24/7 | K-lining,Клининг на ул. Красная Пресня,Уборка на Красной Пресне. Генеральная/поддерживающая уборка.,улицы
uborka-na-ulitse-nikolo-yamskaya-moskva,Уборка на ул. Николоямская — цены | K-lining,Уборка на ул. Николоямская,"Клининг на Николоямской улице. Честные цены, быстрый выезд.",улицы
uborka-na-ulitse-bolshaya-pirogovskaya-moskva,Клининг на ул. Большая Пироговская — 24/7 | K-lining,Клининг на ул. Большая Пироговская,Профессиональная уборка на Большой Пироговской. Окна/после ремонта.,улицы
uborka-na-ulitse-malaya-pirogovskaya-moskva,Уборка на ул. Малая Пироговская — цены | K-lining,Уборка на ул. Малая Пироговская,Клининг на Малой Пироговской. Выезд день-в-день.,улицы
uborka-na-ulitse-khoroshevskoye-shosse-moskva,Клининг на Хорошёвском шоссе — 24/7 | K-lining,Клининг на Хорошёвском шоссе,"Уборка на Хорошёвском шоссе. Прозрачные цены, −10% новым клиентам.",улицы
uborka-na-ulitse-bolshaya-yakimanka-moskva-2,Уборка на ул. Якиманка — цены | K-lining,Уборка на ул. Якиманка,"Клининг на ул. Якиманка. Квартиры, офисы, окна. Работаем 24/7.",улицы
uborka-na-ulitse-trubnaya-ploshchad-moskva,Клининг на Трубной площади — 24/7 | K-lining,Клининг на Трубной площади,Профессиональная уборка на Трубной площади. Срочный выезд.,улицы
uborka-na-ulitse-paveletskaya-ploshchad-moskva,Уборка на Павелецкой площади — цены | K-lining,Уборка на Павелецкой площади,Клининг на Павелецкой площади. Генеральная и поддерживающая.,улицы
uborka-na-ulitse-presnenskiy-val-moskva,Клининг на Пресненском Валу — 24/7 | K-lining,Клининг на Пресненском Валу,"Уборка на Пресненском Валу. Честные цены, быстрый выезд.",улицы
uborka-na-ulitse-spiridonovskiy-pereulok-moskva,Уборка в Спиридоновском переулке — цены | K-lining,Уборка в Спиридоновском переулке,"Клининг в Спиридоновском пер.: квартиры, офисы, окна.",улицы
uborka-na-ulitse-patriarshie-prudy-moskva,Клининг у Патриарших прудов — 24/7 | K-lining,Клининг у Патриарших прудов,"Уборка рядом с Патриаршими прудами. Быстро, аккуратно, выгодно.",улицы
uborka-na-ulitse-chistye-prudy-moskva,Уборка у Чистых прудов — цены | K-lining,Уборка у Чистых прудов,"Клининг у Чистых прудов. Выезд сегодня, без предоплаты.",улицы
uborka-na-ulitse-sokolniki-moskva,Клининг в Сокольниках — 24/7 | K-lining,Клининг в Сокольниках,"Уборка в районе Сокольники: квартиры, офисы, после ремонта. −10% новым клиентам.",улицы
uborka-na-ulitse-krasnaya-ploshchad-moskva,Уборка на Красной площади — цены | K-lining,Уборка на Красной площади,Профессиональная уборка на Красной площади и рядом. Работаем 24/7.,улицы
