URL (slug),Title,H1,Meta Description,Кластер
uborka-na-ulitse-tverskaya-moskva,"Уборка на Тверской улице, Москва — цены | K-lining",Уборка на Тверской улице,"Профессиональная уборка на Тверской улице в Москве. Быстрый выезд, честные цены, скидка −10% на первый заказ. Ближайшее метро: Тверская/Пушкинская.",улицы
uborka-na-ulitse-arbat-moskva,"Уборка на Арбате, Москва — клининг квартир и офисов | K-lining",Уборка на Арбате,"Клининг на ул. Арбат: квартиры, офисы, после ремонта. Работаем 24/7, без предоплаты. Метро Арбатская/Смоленская.",улицы
uborka-na-ulitse-novyj-arbat-moskva,Клининг на Новом Арбате — генеральная уборка | K-lining,Клининг на Новом Арбате,"Генеральная и поддерживающая уборка на Новом Арбате. Прозрачные цены, быстрый расчёт, выезд день-в-день.",улицы
uborka-na-ulitse-leningradskiy-prospekt-moskva,Уборка на Ленинградском проспекте — цены | K-lining,Уборка на Ленинградском проспекте,"Профессиональная уборка на Ленинградском проспекте: квартиры/офисы, окна, после ремонта. Метро Динамо/Аэропорт.",улицы
uborka-na-ulitse-kutuzovskiy-prospekt-moskva,Клининг на Кутузовском проспекте — 24/7 | K-lining,Клининr на Кутузовском проспекте,"Клининговые услуги на Кутузовском проспекте: жилищный и офисный клининг, химчистка, окна. Выезд в день обращения.",улицы
uborka-na-ulitse-sadovoe-koltso-moskva,Уборка на Садовом кольце — профессионально | K-lining,Уборка на Садовом кольце,"Профессиональная уборка и клининг на Садовом кольце. Честные цены, скидка −10% на первый заказ. Метро по кольцу.",улицы
uborka-na-ulitse-prospekt-mira-moskva,Уборка на проспекте Мира — цены | K-lining,Уборка на проспекте Мира,"Профессиональная уборка на проспекте Мира в Москве. Быстрый выезд, честные цены, −10% на первый заказ. Работаем 24/7.",улицы
uborka-na-ulitse-leninskiy-prospekt-moskva,Уборка на Ленинском проспекте — цены | K-lining,Уборка на Ленинском проспекте,"Клининг квартир и офисов на Ленинском проспекте. Генеральная/поддерживающая уборка, окна, после ремонта.",улицы
uborka-na-ulitse-prospekt-vernadskogo-moskva,Клининг на проспекте Вернадского — 24/7 | K-lining,Клининг на проспекте Вернадского,"Уборка на проспекте Вернадского: квартиры, офисы, окна. Выезд день-в-день, честные цены, скидка −10% новичкам.",улицы
uborka-na-ulitse-prospekt-andropova-moskva,Уборка на проспекте Андропова — цены | K-lining,Уборка на проспекте Андропова,"Профессиональная уборка на проспекте Андропова: квартиры/офисы, после ремонта. Работаем без предоплаты.",улицы
uborka-na-ulitse-lomonosovskiy-prospekt-moskva,Клининг на Ломоносовском проспекте — 24/7 | K-lining,Клининг на Ломоносовском проспекте,"Генеральная и регулярная уборка на Ломоносовском проспекте. Быстро, аккуратно, с гарантией.",улицы
uborka-na-ulitse-michurinskiy-prospekt-moskva,Уборка на Мичуринском проспекте — цены | K-lining,Уборка на Мичуринском проспекте,"Квартиры, офисы, после ремонта на Мичуринском проспекте. Честные цены, скидки новым клиентам.",улицы
uborka-na-ulitse-prospekt-marshala-zhukova-moskva,Клининг на проспекте Маршала Жукова — 24/7 | K-lining,Клининг на проспекте Маршала Жукова,Профессиональная уборка любой сложности на проспекте Маршала Жукова. Выезд сегодня.,улицы
uborka-na-ulitse-shosse-entuziastov-moskva,Уборка на шоссе Энтузиастов — цены | K-lining,Уборка на шоссе Энтузиастов,"Клининг квартир и офисов на шоссе Энтузиастов. Срочный выезд, адекватные цены, −10% на первый заказ.",улицы
uborka-na-ulitse-volgogradskiy-prospekt-moskva,Клининг на Волгоградском проспекте — 24/7 | K-lining,Клининг на Волгоградском проспекте,Генеральная/поддерживающая уборка на Волгоградском проспекте. Работаем без предоплаты.,улицы
uborka-na-ulitse-ryazanskiy-prospekt-moskva,Уборка на Рязанском проспекте — цены | K-lining,Уборка на Рязанском проспекте,"Профессиональная уборка на Рязанском проспекте: квартиры/офисы, окна, после ремонта. Быстро и аккуратно.",улицы
uborka-na-ulitse-kashirskoe-shosse-moskva,Клининг на Каширском шоссе — 24/7 | K-lining,Клининг на Каширском шоссе,"Уборка на Каширском шоссе. Честные цены, быстрый выезд, скидка −10% новым клиентам.",улицы
uborka-na-ulitse-varshavskoe-shosse-moskva,Уборка на Варшавском шоссе — цены | K-lining,Уборка на Варшавском шоссе,"Клининг квартир/офисов на Варшавском шоссе. Генеральная, после ремонта, окна. Работаем 24/7.",улицы
uborka-na-ulitse-dmitrovskoe-shosse-moskva,Клининг на Дмитровском шоссе — 24/7 | K-lining,Клининг на Дмитровском шоссе,"Профессиональная уборка на Дмитровском шоссе. Прозрачные цены, выезд в день обращения.",улицы
uborka-na-ulitse-yaroslavskoe-shosse-moskva,Уборка на Ярославском шоссе — цены | K-lining,Уборка на Ярославском шоссе,"Квартиры, офисы, после ремонта на Ярославском шоссе. Быстрый старт работ, без предоплаты.",улицы
uborka-na-ulitse-leningradskoe-shosse-moskva,Клининг на Ленинградском шоссе — 24/7 | K-lining,Клининг на Ленинградском шоссе,"Уборка на Ленинградском шоссе. Честные цены, −10% на первый заказ. Выезд день-в-день.",улицы
uborka-na-ulitse-volokolamskoe-shosse-moskva,Уборка на Волоколамском шоссе — цены | K-lining,Уборка на Волоколамском шоссе,"Профессиональная уборка на Волоколамском шоссе: квартиры, офисы, окна.",улицы
uborka-na-ulitse-rublyovskoe-shosse-moskva,Клининг на Рублёвском шоссе — 24/7 | K-lining,Клининг на Рублёвском шоссе,Генеральная/поддерживающая уборка на Рублёвском шоссе. Срочный выезд.,улицы
uborka-na-ulitse-zvenigorodskoe-shosse-moskva,Уборка на Звенигородском шоссе — цены | K-lining,Уборка на Звенигородском шоссе,"Клининг на Звенигородском шоссе. Прозрачные цены, −10% новым клиентам.",улицы
uborka-na-ulitse-khoroshevskoe-shosse-moskva,Клининг на Хорошёвском шоссе — 24/7 | K-lining,Клининг на Хорошёвском шоссе,"Профессиональная уборка на Хорошёвском шоссе. Быстрый выезд, без предоплаты.",улицы
uborka-na-ulitse-altufevskoe-shosse-moskva,Уборка на Алтуфьевском шоссе — цены | K-lining,Уборка на Алтуфьевском шоссе,"Квартиры, офисы, окна на Алтуфьевском шоссе. Работаем круглосуточно.",улицы
uborka-na-ulitse-sevastopolskiy-prospekt-moskva,Клининг на Севастопольском проспекте — 24/7 | K-lining,Клининr на Севастопольском проспекте,Профессиональная уборка на Севастопольском проспекте. Честные цены.,улицы
uborka-na-ulitse-balaklavskiy-prospekt-moskva,Уборка на Балаклавском проспекте — цены | K-lining,Уборка на Балаклавском проспекте,"Клининг на Балаклавском проспекте: квартиры, офисы, после ремонта. −10% новым клиентам.",улицы
uborka-na-ulitse-nakhimovskiy-prospekt-moskva,Клининг на Нахимовском проспекте — 24/7 | K-lining,Клининг на Нахимовском проспекте,Генеральная и регулярная уборка на Нахимовском проспекте. Выезд сегодня.,улицы
uborka-na-ulitse-komsomolskiy-prospekt-moskva,Уборка на Комсомольском проспекте — цены | K-lining,Уборка на Комсомольском проспекте,"Профессиональная уборка на Комсомольском проспекте. Быстро, аккуратно, выгодно.",улицы
uborka-na-ulitse-prospekt-budennogo-moskva,Клининг на проспекте Будённого — 24/7 | K-lining,Клининг на проспекте Будённого,"Уборка на проспекте Будённого: квартиры/офисы, окна, после ремонта. Срочный выезд.",улицы
uborka-na-ulitse-novoslobodskaya-moskva,Уборка на ул. Новослободская — цены | K-lining,Уборка на ул. Новослободская,"Клининг на ул. Новослободская: квартиры, офисы, окна. Выезд день-в-день.",улицы
uborka-na-ulitse-butyrskaya-moskva,Клининг на ул. Бутырская — 24/7 | K-lining,Клининг на ул. Бутырская,"Профессиональная уборка на ул. Бутырская. Честные цены, −10% новым клиентам.",улицы
uborka-na-ulitse-sushchevskiy-val-moskva,Уборка на Сущёвском Валу — цены | K-lining,Уборка на Сущёвском Валу,Генеральная и поддерживающая уборка на Сущёвском Валу. Без предоплаты.,улицы
uborka-na-ulitse-zemlyanoy-val-moskva,Клининг на Земляном Валу — 24/7 | K-lining,Клининг на Земляном Валу,Профессиональная уборка на Земляном Валу. Быстро и аккуратно.,улицы
uborka-na-ulitse-valovaya-moskva,Уборка на ул. Валовая — цены | K-lining,Уборка на ул. Валовая,"Клининг на ул. Валовая: квартиры, офисы, окна. Выезд день-в-день.",улицы
uborka-na-ulitse-zatsepskiy-val-moskva,Клининг на Зацепском Валу — 24/7 | K-lining,Клининг на Зацепском Валу,Профессиональная уборка на Зацепском Валу. Честные цены.,улицы
uborka-na-ulitse-taganskaya-moskva,Уборка на ул. Таганская — цены | K-lining,Уборка на ул. Таганская,"Клининг на ул. Таганская: квартиры/офисы, после ремонта. −10% первым клиентам.",улицы
uborka-na-ulitse-marksistskaya-moskva,Клининг на ул. Марксистская — 24/7 | K-lining,Клининг на ул. Марксистская,Профессиональная уборка на ул. Марксистская. Выезд в день обращения.,улицы
uborka-na-ulitse-pyatnitskaya-moskva,Уборка на ул. Пятницкая — цены | K-lining,Уборка на ул. Пятницкая,"Клининг на ул. Пятницкая: квартиры, офисы, окна. Честные цены.",улицы
uborka-na-ulitse-bolshaya-ordynka-moskva,Клининг на ул. Большая Ордынка — 24/7 | K-lining,Клининг на ул. Большая Ордынка,"Уборка на Большой Ордынке. Генеральная/поддерживающая, без предоплаты.",улицы
uborka-na-ulitse-bolshaya-polyanka-moskva,Уборка на ул. Большая Полянка — цены | K-lining,Уборка на ул. Большая Полянка,Профессиональный клининг на Большой Полянке. Срочный выезд.,улицы
uborka-na-ulitse-bolshaya-serpukhovskaya-moskva,Клининг на ул. Большая Серпуховская — 24/7 | K-lining,Клининг на ул. Большая Серпуховская,"Уборка на Большой Серпуховской: квартиры/офисы, окна, после ремонта.",улицы
uborka-na-ulitse-dubininskaya-moskva,Уборка на ул. Дубининская — цены | K-lining,Уборка на ул. Дубининская,"Клининг на ул. Дубининская. Выезд день-в-день, честные цены.",улицы
uborka-na-ulitse-bolshaya-yakimanka-moskva,Клининг на ул. Большая Якиманка — 24/7 | K-lining,Клининг на ул. Большая Якиманка,Профессиональная уборка на Большой Якиманке. Работаем круглосуточно.,улицы
uborka-na-ulitse-prechistenka-moskva,Уборка на ул. Пречистенка — цены | K-lining,Уборка на ул. Пречистенка,"Клининг на Пречистенке: квартиры, офисы, окна. Скидка −10% новым клиентам.",улицы
uborka-na-ulitse-ostozhenka-moskva,Клининг на ул. Остоженка — 24/7 | K-lining,Клининг на ул. Остоженка,"Профессиональная уборка на Остоженке. Выезд сегодня, честные цены.",улицы
uborka-na-ulitse-znamenka-moskva,Уборка на ул. Знаменка — цены | K-lining,Уборка на ул. Знаменка,"Клининг на ул. Знаменка: квартиры/офисы, после ремонта. Без предоплаты.",улицы
uborka-na-ulitse-volkhonka-moskva,Клининг на ул. Волхонка — 24/7 | K-lining,Клининг на ул. Волхонка,"Уборка на ул. Волхонка. Генеральная и регулярная, окна.",улицы
uborka-na-ulitse-nikolskaya-moskva,Уборка на ул. Никольская — цены | K-lining,Уборка на ул. Никольская,Профессиональный клининг на Никольской улице. Выезд день-в-день.,улицы
uborka-na-ulitse-varvarka-moskva,Клининг на ул. Варварка — 24/7 | K-lining,Клининг на ул. Варварка,"Уборка на Варварке: квартиры/офисы, окна. Честные цены.",улицы
uborka-na-ulitse-ilyinka-moskva,Уборка на ул. Ильинка — цены | K-lining,Уборка на ул. Ильинка,"Клининг на Ильинке. Быстрый выезд, −10% новым клиентам.",улицы
uborka-na-ulitse-petrovka-moskva,Клининг на ул. Петровка — 24/7 | K-lining,Клининг на ул. Петровка,Профессиональная уборка на Петровке. Работаем без предоплаты.,улицы
uborka-na-ulitse-bolshaya-dmitrovka-moskva,Уборка на ул. Большая Дмитровка — цены | K-lining,Уборка на ул. Большая Дмитровка,"Клининг на Большой Дмитровке. Генеральная/поддерживающая, окна.",улицы
uborka-na-ulitse-malaya-dmitrovka-moskva,Клининг на ул. Малая Дмитровка — 24/7 | K-lining,Клининг на ул. Малая Дмитровка,"Уборка на Малой Дмитровке. Честные цены, выезд сегодня.",улицы
uborka-na-ulitse-bolshaya-nikitskaya-moskva,Уборка на ул. Большая Никитская — цены | K-lining,Уборка на ул. Большая Никитская,Профессиональная уборка на Большой Никитской. −10% первым заказам.,улицы
uborka-na-ulitse-nikitskiy-bulvar-moskva,Клининг на Никитском бульваре — 24/7 | K-lining,Клининг на Никитском бульваре,"Уборка на Никитском бульваре. Квартиры, офисы, окна.",улицы
uborka-na-ulitse-tverskoy-bulvar-moskva,Уборка на Тверском бульваре — цены | K-lining,Уборка на Тверском бульваре,"Клининг на Тверском бульваре. Срочный выезд, честные цены.",улицы
uborka-na-ulitse-gogolevskiy-bulvar-moskva,Клининг на Гоголевском бульваре — 24/7 | K-lining,Клининг на Гоголевском бульваре,Профессиональная уборка на Гоголевском бульваре. Работаем круглосуточно.,улицы
uborka-na-ulitse-strastnoy-bulvar-moskva,Уборка на Страстном бульваре — цены | K-lining,Уборка на Страстном бульваре,"Клининг на Страстном бульваре: квартиры/офисы, окна.",улицы
uborka-na-ulitse-rozhdestvenskiy-bulvar-moskva,Клининг на Рождественском бульваре — 24/7 | K-lining,Клининг на Рождественском бульваре,Уборка на Рождественском бульваре. −10% новым клиентам.,улицы
uborka-na-ulitse-sretenskiy-bulvar-moskva,Уборка на Сретенском бульваре — цены | K-lining,Уборка на Сретенском бульваре,Клининг на Сретенском бульваре. Выезд в день обращения.,улицы
uborka-na-ulitse-chistoprudnyj-bulvar-moskva,Клининг на Чистопрудном бульваре — 24/7 | K-lining,Клининг на Чистопрудном бульваре,Профессиональная уборка на Чистопрудном бульваре.,улицы
uborka-na-ulitse-yauzskiy-bulvar-moskva,Уборка на Яузском бульваре — цены | K-lining,Уборка на Яузском бульваре,"Клининг на Яузском бульваре. Честные цены, быстрый выезд.",улицы
uborka-na-ulitse-pokrovskiy-bulvar-moskva,Клининг на Покровском бульваре — 24/7 | K-lining,Клининг на Покровском бульваре,"Уборка на Покровском бульваре: квартиры, офисы, окна.",улицы
uborka-na-ulitse-myasnitskaya-moskva,Уборка на ул. Мясницкая — цены | K-lining,Уборка на ул. Мясницкая,Клининг на Мясницкой улице. Выезд день-в-день.,улицы
uborka-na-ulitse-pokrovka-moskva,Клининг на ул. Покровка — 24/7 | K-lining,Клининг на ул. Покровка,Профессиональная уборка на Покровке. Честные цены.,улицы
uborka-na-ulitse-sretenka-moskva,Уборка на ул. Сретенка — цены | K-lining,Уборка на ул. Сретенка,"Клининг на Сретенке: квартиры/офисы, после ремонта. −10% новым клиентам.",улицы
uborka-na-ulitse-trubnaya-moskva,Клининг на ул. Трубная — 24/7 | K-lining,Клининг на ул. Трубная,"Уборка на Трубной улице. Быстрый выезд, без предоплаты.",улицы
uborka-na-ulitse-mokhovaya-moskva,Уборка на ул. Моховая — цены | K-lining,Уборка на ул. Моховая,Клининг на Моховой улице. Генеральная и поддерживающая уборка.,улицы
uborka-na-ulitse-bolshaya-lubyanka-moskva,Клининг на ул. Большая Лубянка — 24/7 | K-lining,Клининг на ул. Большая Лубянка,Профессиональная уборка на Большой Лубянке. Честные цены.,улицы
uborka-na-ulitse-vavilova-moskva,Уборка на ул. Вавилова — цены | K-lining,Уборка на ул. Вавилова,"Клининг на ул. Вавилова: квартиры/офисы, окна, после ремонта.",улицы
uborka-na-ulitse-akademika-koroleva-moskva,Клининг на ул. Академика Королёва — 24/7 | K-lining,Клининг на ул. Академика Королёва,Уборка на ул. Академика Королёва. Выезд сегодня.,улицы
uborka-na-ulitse-akademika-pilyugina-moskva,Уборка на ул. Академика Пилюгина — цены | K-lining,Уборка на ул. Академика Пилюгина,Профессиональная уборка на ул. Академика Пилюгина. Честные цены.,улицы
uborka-na-ulitse-kremlevskaya-naberezhnaya-moskva,Клининг на Кремлёвской набережной — 24/7 | K-lining,Клининг на Кремлёвской набережной,"Уборка на Кремлёвской набережной. Квартиры, офисы, окна.",улицы
uborka-na-ulitse-berezhkovskaya-naberezhnaya-moskva,Уборка на Бережковской набережной — цены | K-lining,Уборка на Бережковской набережной,Клининг на Бережковской набережной. Выезд день-в-день.,улицы
uborka-na-ulitse-frunzenskaya-naberezhnaya-moskva,Клининг на Фрунзенской набережной — 24/7 | K-lining,Клининг на Фрунзенской набережной,Профессиональная уборка на Фрунзенской набережной. Честные цены.,улицы
uborka-na-ulitse-savvinskaya-naberezhnaya-moskva,Уборка на Саввинской набережной — цены | K-lining,Уборка на Саввинской набережной,Клининг на Саввинской набережной. −10% новым клиентам.,улицы
uborka-na-ulitse-presnenskaya-naberezhnaya-moskva,Клининг на Пресненской набережной — 24/7 | K-lining,Клининг на Пресненской набережной,Уборка на Пресненской набережной (Москва-Сити). Срочный выезд.,улицы
uborka-na-ulitse-sofiyskaya-naberezhnaya-moskva,Уборка на Софийской набережной — цены | K-lining,Уборка на Софийской набережной,Профессиональная уборка на Софийской набережной. Выгодные условия.,улицы
uborka-na-ulitse-raushskaya-naberezhnaya-moskva,Клининг на Раушской набережной — 24/7 | K-lining,Клининг на Раушской набережной,"Уборка на Раушской набережной. Квартиры/офисы, окна.",улицы
